{
  "id": "f_chat-06-marta-cuenta-cobro",
  "ciclo_id": "2026-10",
  "documento": {
    "id": "d_chat-06-marta-cuenta-cobro",
    "hash": "e6aa8da6b7e30a2ba610156d19bf6a44542e933d8876635ba1a4095dbb778384",
    "canal": "chat",
    "formato": "texto",
    "tipo_documento": "cuenta_de_cobro",
    "recibido_en": "2026-10-12T09:00:00Z"
  },
  "emisor": {
    "nombre": "Marta Ruiz",
    "nombre_normalizado": "MARTARUIZ",
    "id_fiscal": "",
    "pais": "CO"
  },
  "referencias": {
    "numero": "CC-22",
    "numero_normalizado": "CC22",
    "acuerdo_ref": ""
  },
  "fechas": {
    "emision": "2026-10-12",
    "vencimiento": null
  },
  "montos": {
    "moneda": "USD",
    "total_menor": "90000",
    "suma_lineas_menor": "90000",
    "lineas": [
      {
        "descripcion": "30 horas x USD 30",
        "total_menor": "90000"
      }
    ]
  },
  "cuenta": {
    "pais": "CO",
    "ultimos4": "2291"
  },
  "evidencia": {
    "tipo_documento": "Cuenta de cobro No. CC-22",
    "numero_factura": "CC-22",
    "monto_total": "USD 900 (sin impuestos)",
    "moneda": "USD 900",
    "proveedor": "Marta Ruiz",
    "cuenta": "mi cuenta terminada en 2291, pais Colombia"
  },
  "confianza": {
    "tipo_documento": 0.95,
    "numero_factura": 0.95,
    "monto_total": 0.95,
    "moneda": 0.95,
    "proveedor": 0.95,
    "cuenta": 0.95
  },
  "verificaciones": {
    "esquema": "ok",
    "dinero_presente": "ok",
    "suma_lineas": "ok",
    "cita_evidencia": "ok",
    "tipo": "ok",
    "segunda_lectura": {
      "estado": "coincide",
      "detalle": []
    }
  },
  "lectura": {
    "metodo": "modelo",
    "modelo": "manual-congelada",
    "reintentos": 0,
    "tokens_entrada": 0,
    "tokens_salida": 0,
    "costo_microusd": "0",
    "desde_cache": true,
    "motivo_falla": null
  },
  "proveedor_asignado": {
    "proveedor_id": "prov_marta",
    "metodo": "nombre",
    "pista": null
  }
}
