{
  "id": "f_oc-d",
  "ciclo_id": "2026-10",
  "documento": {
    "id": "d_oc-d",
    "hash": "61f4c6a03e29414acb120e924bff80fabeb826f188c1691b947e5218af673090",
    "canal": "hoja",
    "formato": "csv",
    "tipo_documento": "factura",
    "recibido_en": "2026-10-14T09:00:00Z"
  },
  "emisor": {
    "nombre": "Codigo Verde SAS",
    "nombre_normalizado": "CODIGOVERDESAS",
    "id_fiscal": "",
    "pais": "CO"
  },
  "referencias": {
    "numero": "CV-14",
    "numero_normalizado": "CV14",
    "acuerdo_ref": "AC-CVERDE-2026-02"
  },
  "fechas": {
    "emision": "2026-10-14",
    "vencimiento": "2026-11-13"
  },
  "montos": {
    "moneda": "USD",
    "total_menor": "280000",
    "suma_lineas_menor": "280000",
    "lineas": [
      {
        "descripcion": "Licencia plataforma reportes",
        "total_menor": "200000"
      },
      {
        "descripcion": "Soporte priorizado",
        "total_menor": "60000"
      },
      {
        "descripcion": "Informe trimestral",
        "total_menor": "20000"
      }
    ]
  },
  "cuenta": {
    "pais": "CO",
    "ultimos4": "1096"
  },
  "proveedor_asignado": {
    "proveedor_id": "prov_cverde",
    "metodo": "nombre",
    "pista": null
  },
  "evidencia": {
    "tipo_documento": "Exportacion de facturacion",
    "numero_factura": "CV-14",
    "monto_total": "total,2800.00",
    "moneda": "USD",
    "proveedor": "Codigo Verde SAS",
    "cuenta": "CO,1096"
  },
  "confianza": {
    "tipo_documento": 0.95,
    "numero_factura": 0.95,
    "monto_total": 0.95,
    "moneda": 0.95,
    "proveedor": 0.95,
    "cuenta": 0.95
  },
  "verificaciones": {
    "esquema": "ok",
    "dinero_presente": "ok",
    "suma_lineas": "ok",
    "cita_evidencia": "ok",
    "tipo": "ok",
    "segunda_lectura": {
      "estado": "coincide",
      "detalle": []
    }
  },
  "lectura": {
    "metodo": "modelo",
    "modelo": "manual-congelada",
    "reintentos": 0,
    "tokens_entrada": 0,
    "tokens_salida": 0,
    "costo_microusd": "0",
    "desde_cache": true,
    "motivo_falla": null
  }
}
