{
  "id": "f_18",
  "ciclo_id": "2026-10",
  "documento": {
    "id": "d_18",
    "hash": "dc3c7fe09eb9766f6eea9950d131c200a01370bda1168cd276507d35efd25e86",
    "canal": "pdf",
    "formato": "pdf",
    "tipo_documento": "estado_de_cuenta",
    "recibido_en": "2026-10-15T00:00:00Z"
  },
  "emisor": {
    "nombre": "CODIGO VERDE SAS",
    "nombre_normalizado": "CODIGOVERDESAS",
    "id_fiscal": "",
    "pais": "CO"
  },
  "referencias": {
    "numero": "",
    "numero_normalizado": "",
    "acuerdo_ref": "AC-CVERDE-2026-02"
  },
  "fechas": {
    "emision": "2026-10-15",
    "vencimiento": null
  },
  "montos": {
    "moneda": "USD",
    "total_menor": "100000",
    "suma_lineas_menor": "580000",
    "lineas": [
      {
        "descripcion": "CV-08 Factura",
        "total_menor": "110000"
      },
      {
        "descripcion": "CV-10 Factura",
        "total_menor": "180000"
      },
      {
        "descripcion": "CV-12 Factura",
        "total_menor": "290000"
      }
    ]
  },
  "cuenta": {
    "pais": "CO",
    "ultimos4": "1096"
  },
  "proveedor_asignado": {
    "proveedor_id": null,
    "metodo": "ninguno",
    "pista": null
  },
  "evidencia": {
    "tipo_documento": "ESTADO DE CUENTA AL 15/10/2026",
    "monto_total": "Saldo informativo a la fecha                   1.000,00 USD",
    "moneda": "1.000,00 USD",
    "proveedor": "CODIGO VERDE SAS",
    "cuenta": "terminada en 1096"
  },
  "confianza": {
    "tipo_documento": 0.95,
    "monto_total": 0.97,
    "moneda": 0.98,
    "proveedor": 0.97,
    "cuenta": 0.95
  },
  "verificaciones": {
    "esquema": "ok",
    "dinero_presente": "ok",
    "suma_lineas": "falla",
    "cita_evidencia": "ok",
    "tipo": "ok",
    "segunda_lectura": {
      "estado": "coincide",
      "detalle": []
    }
  },
  "lectura": {
    "metodo": "modelo",
    "modelo": "manual-congelada",
    "reintentos": 0,
    "tokens_entrada": 0,
    "tokens_salida": 0,
    "costo_microusd": "0",
    "desde_cache": true,
    "motivo_falla": null
  }
}
