{
  "id": "f_09",
  "ciclo_id": "2026-10",
  "documento": {
    "id": "d_09",
    "hash": "8d95acbf7c636383ee875af376d7696ad755e67b417f8f8a93c22886c44432d7",
    "canal": "correo",
    "formato": "texto",
    "tipo_documento": "factura",
    "recibido_en": "2026-10-08T16:45:00Z"
  },
  "emisor": {
    "nombre": "NUEVO LOGOS LLC",
    "nombre_normalizado": "NUEVOLOGOSLLC",
    "id_fiscal": "",
    "pais": "US"
  },
  "referencias": {
    "numero": "NL-7",
    "numero_normalizado": "NL7",
    "acuerdo_ref": "AC-NLOGOS-2026-01"
  },
  "fechas": {
    "emision": "2026-10-08",
    "vencimiento": "2026-11-07"
  },
  "montos": {
    "moneda": "USD",
    "total_menor": "90000",
    "suma_lineas_menor": "90000",
    "lineas": [
      {
        "descripcion": "Brand naming workshop (1 day)",
        "total_menor": "90000"
      }
    ]
  },
  "cuenta": {
    "pais": "US",
    "ultimos4": "3318"
  },
  "proveedor_asignado": {
    "proveedor_id": "prov_logos",
    "metodo": "nombre",
    "pista": null
  },
  "evidencia": {
    "tipo_documento": "Invoice No. NL-7",
    "numero_factura": "NL-7",
    "monto_total": "TOTAL                              USD 900.00",
    "moneda": "USD 900.00",
    "proveedor": "NUEVO LOGOS LLC",
    "cuenta": "Account ending 3318"
  },
  "confianza": {
    "tipo_documento": 0.95,
    "numero_factura": 0.97,
    "monto_total": 0.97,
    "moneda": 0.98,
    "proveedor": 0.97,
    "cuenta": 0.95
  },
  "verificaciones": {
    "esquema": "ok",
    "dinero_presente": "ok",
    "suma_lineas": "ok",
    "cita_evidencia": "ok",
    "tipo": "ok",
    "segunda_lectura": {
      "estado": "coincide",
      "detalle": []
    }
  },
  "lectura": {
    "metodo": "modelo",
    "modelo": "manual-congelada",
    "reintentos": 0,
    "tokens_entrada": 0,
    "tokens_salida": 0,
    "costo_microusd": "0",
    "desde_cache": true,
    "motivo_falla": null
  }
}
