{
  "id": "f_07",
  "ciclo_id": "2026-10",
  "documento": {
    "id": "d_07",
    "hash": "0f6c508a62378f7b1b645fecab50198ea9889e15a43657bf16efc31a8869459c",
    "canal": "correo",
    "formato": "texto",
    "tipo_documento": "factura",
    "recibido_en": "2026-10-15T11:20:00Z"
  },
  "emisor": {
    "nombre": "PIXEL STUDIO LTDA",
    "nombre_normalizado": "PIXELSTUDIOLTDA",
    "id_fiscal": "",
    "pais": "BR"
  },
  "referencias": {
    "numero": "PX-2307",
    "numero_normalizado": "PX2307",
    "acuerdo_ref": "AC-PIXEL-2026-03"
  },
  "fechas": {
    "emision": "2026-10-15",
    "vencimiento": "2026-11-14"
  },
  "montos": {
    "moneda": "BRL",
    "total_menor": "740000",
    "suma_lineas_menor": "740000",
    "lineas": [
      {
        "descripcion": "Edicao de video institucional",
        "total_menor": "590000"
      },
      {
        "descripcion": "Legendas e versoes para redes",
        "total_menor": "150000"
      }
    ]
  },
  "cuenta": {
    "pais": "BR",
    "ultimos4": "8830"
  },
  "proveedor_asignado": {
    "proveedor_id": "prov_pixel",
    "metodo": "nombre",
    "pista": null
  },
  "evidencia": {
    "tipo_documento": "FATURA No. PX-2307",
    "numero_factura": "PX-2307",
    "monto_total": "TOTAL                                7.400,00 BRL",
    "moneda": "7.400,00 BRL",
    "proveedor": "PIXEL STUDIO LTDA",
    "cuenta": "Conta final 8830"
  },
  "confianza": {
    "tipo_documento": 0.95,
    "numero_factura": 0.97,
    "monto_total": 0.97,
    "moneda": 0.98,
    "proveedor": 0.97,
    "cuenta": 0.95
  },
  "verificaciones": {
    "esquema": "ok",
    "dinero_presente": "ok",
    "suma_lineas": "ok",
    "cita_evidencia": "ok",
    "tipo": "ok",
    "segunda_lectura": {
      "estado": "coincide",
      "detalle": []
    }
  },
  "lectura": {
    "metodo": "modelo",
    "modelo": "manual-congelada",
    "reintentos": 0,
    "tokens_entrada": 0,
    "tokens_salida": 0,
    "costo_microusd": "0",
    "desde_cache": true,
    "motivo_falla": null
  }
}
