{
  "id": "f_pdf-15-devnorte-desconocido",
  "ciclo_id": "2026-10",
  "documento": {
    "id": "d_pdf-15-devnorte-desconocido",
    "hash": "aa2e0ab49b82f84050d1fb2a3f5a1651b06cb4d5bc1cbb789b527258c5f542d7",
    "canal": "pdf",
    "formato": "pdf",
    "tipo_documento": "desconocido",
    "recibido_en": "2026-10-12T09:00:00Z"
  },
  "emisor": {
    "nombre": "DevNorte SA de CV",
    "nombre_normalizado": "DEVNORTESADECV",
    "id_fiscal": "",
    "pais": "MX"
  },
  "referencias": {
    "numero": "ACTA-17",
    "numero_normalizado": "ACTA17",
    "acuerdo_ref": ""
  },
  "fechas": {
    "emision": "2026-10-12",
    "vencimiento": null
  },
  "montos": {
    "moneda": "USD",
    "total_menor": "0",
    "suma_lineas_menor": null,
    "lineas": []
  },
  "cuenta": {
    "pais": "MX",
    "ultimos4": "3306"
  },
  "evidencia": {
    "tipo_documento": "*** ACTA DE ENTREGA ***",
    "numero_factura": "No. ACTA-17",
    "monto_total": "TOTAL USD 0,00",
    "moneda": "TOTAL USD",
    "proveedor": "DevNorte SA de CV",
    "cuenta": "Cuenta ****3306 (MX)"
  },
  "confianza": {
    "tipo_documento": 0.95,
    "numero_factura": 0.95,
    "monto_total": 0.95,
    "moneda": 0.95,
    "proveedor": 0.95,
    "cuenta": 0.95
  },
  "verificaciones": {
    "esquema": "ok",
    "dinero_presente": "falla",
    "suma_lineas": "no_aplica",
    "cita_evidencia": "ok",
    "tipo": "ok",
    "segunda_lectura": {
      "estado": "coincide",
      "detalle": []
    }
  },
  "lectura": {
    "metodo": "modelo",
    "modelo": "manual-congelada",
    "reintentos": 0,
    "tokens_entrada": 0,
    "tokens_salida": 0,
    "costo_microusd": "0",
    "desde_cache": true,
    "motivo_falla": null
  },
  "proveedor_asignado": {
    "proveedor_id": "prov_devnorte",
    "metodo": "nombre",
    "pista": null
  }
}
